
Gurobi 11.0.3 (mac64[x86]) logging started Fri Mar  7 09:44:45 2025

Set parameter LogFile to value "Results/result_v2_B_8.log"
Set parameter TimeLimit to value 36000
Gurobi Optimizer version 11.0.3 build v11.0.3rc0 (mac64[x86] - Darwin 23.4.0 23E214)

CPU model: Intel(R) Core(TM) i7-1060NG7 CPU @ 1.20GHz
Thread count: 4 physical cores, 8 logical processors, using up to 8 threads

Optimize a model with 768960 rows, 893424 columns and 3037504 nonzeros
Model fingerprint: 0xbb26646d
Coefficient statistics:
  Matrix range     [1e+00, 1e+00]
  Objective range  [6e-02, 5e+00]
  Bounds range     [0e+00, 0e+00]
  RHS range        [1e-02, 1e+03]
Presolve removed 632227 rows and 636931 columns
Presolve time: 2.78s
Presolved: 136733 rows, 256493 columns, 851248 nonzeros

Concurrent LP optimizer: dual simplex and barrier
Showing barrier log only...

Ordering time: 2.37s

Barrier statistics:
 AA' NZ     : 2.879e+05
 Factor NZ  : 7.744e+06 (roughly 120 MB of memory)
 Factor Ops : 8.968e+09 (less than 1 second per iteration)
 Threads    : 3

                  Objective                Residual
Iter       Primal          Dual         Primal    Dual     Compl     Time
   0  -3.38551101e+06  7.53149058e+07  8.66e+03 6.70e+00  2.05e+04     6s
   1  -8.44079213e+06  6.42924568e+07  1.38e+03 4.16e+00  3.54e+03     7s
   2  -7.28388808e+06  2.38198759e+07  2.73e+02 1.64e-01  5.34e+02     7s
   3  -2.70136658e+06  4.25129757e+06  4.12e+01 7.19e-03  8.72e+01     8s
   4  -4.94651427e+05  9.13217893e+05  6.50e+00 2.53e-04  1.46e+01     9s
   5  -1.20474804e+05  2.18043091e+05  1.26e+00 5.12e-13  3.02e+00     9s
   6  -5.79109586e+03  4.11708171e+04  7.27e-02 4.55e-13  3.55e-01    10s
   7   8.69572907e+03  1.69544555e+04  3.95e-03 1.15e-13  5.90e-02    11s
   8   1.07143911e+04  1.23916136e+04  6.72e-04 1.67e-13  1.20e-02    12s
   9   1.13225697e+04  1.18200995e+04  1.62e-04 1.94e-13  3.55e-03    13s
  10   1.15156742e+04  1.16699509e+04  5.00e-05 1.98e-13  1.10e-03    15s
  11   1.15908428e+04  1.16412126e+04  1.21e-05 2.23e-13  3.59e-04    17s
  12   1.16144899e+04  1.16290989e+04  2.05e-06 2.40e-13  1.03e-04    18s

Barrier performed 12 iterations in 19.31 seconds (7.92 work units)
Barrier solve interrupted - model solved by another algorithm


Solved with dual simplex
Extra simplex iterations after uncrush: 13
Iteration    Objective       Primal Inf.    Dual Inf.      Time
   77112    1.1620696e+04   0.000000e+00   0.000000e+00     20s

Use crossover to convert LP symmetric solution to basic solution...
Crossover log...

    3355 DPushes remaining with DInf 0.0000000e+00                20s
       0 DPushes remaining with DInf 0.0000000e+00                21s

    1763 PPushes remaining with PInf 0.0000000e+00                21s
       0 PPushes remaining with PInf 0.0000000e+00                21s

  Push phase complete: Pinf 0.0000000e+00, Dinf 6.2794214e-13     21s

Iteration    Objective       Primal Inf.    Dual Inf.      Time
   93705    1.1620943e+04   0.000000e+00   1.750426e+04     26s
   98885    1.1621071e+04   0.000000e+00   6.419329e+03     30s
  102071    1.1621112e+04   0.000000e+00   4.427471e+03     37s
  102885    1.1621118e+04   0.000000e+00   4.887060e+03     40s
  105667    1.1621132e+04   0.000000e+00   1.687856e+04     45s
  107635    1.1621142e+04   0.000000e+00   9.019396e+03     52s
  108594    1.1621145e+04   0.000000e+00   9.182841e+03     55s
  111126    1.1621150e+04   0.000000e+00   4.566313e+03     61s
  113006    1.1621152e+04   0.000000e+00   1.105002e+03     65s
  116265    1.1621154e+04   0.000000e+00   5.614728e+02     70s
  119410    1.1621154e+04   0.000000e+00   4.343750e-02     75s
Extra simplex iterations after uncrush: 37840
  119896    1.1620696e+04   0.000000e+00   0.000000e+00     77s

Solved in 119896 iterations and 76.93 seconds (33.67 work units)
Optimal objective  1.162069615e+04

Gurobi 11.0.3 (mac64[x86]) logging started Fri Mar  7 09:56:48 2025

Set parameter LogFile to value "Results/result_v2_B_8.log"
Set parameter TimeLimit to value 36000
Gurobi Optimizer version 11.0.3 build v11.0.3rc0 (mac64[x86] - Darwin 23.4.0 23E214)

CPU model: Intel(R) Core(TM) i7-1060NG7 CPU @ 1.20GHz
Thread count: 4 physical cores, 8 logical processors, using up to 8 threads

Optimize a model with 768960 rows, 893424 columns and 3037504 nonzeros
Model fingerprint: 0xbb26646d
Coefficient statistics:
  Matrix range     [1e+00, 1e+00]
  Objective range  [6e-02, 5e+00]
  Bounds range     [0e+00, 0e+00]
  RHS range        [1e-02, 1e+03]
Presolve removed 632227 rows and 636931 columns
Presolve time: 3.27s
Presolved: 136733 rows, 256493 columns, 851248 nonzeros

Concurrent LP optimizer: dual simplex and barrier
Showing barrier log only...

Ordering time: 1.94s

Barrier statistics:
 AA' NZ     : 2.879e+05
 Factor NZ  : 7.744e+06 (roughly 120 MB of memory)
 Factor Ops : 8.968e+09 (less than 1 second per iteration)
 Threads    : 3

                  Objective                Residual
Iter       Primal          Dual         Primal    Dual     Compl     Time
   0  -3.38567587e+06  7.53147354e+07  8.65e+03 6.70e+00  2.05e+04     6s
   1  -8.44076088e+06  6.42909567e+07  1.38e+03 4.16e+00  3.54e+03     7s
   2  -7.28372413e+06  2.38190405e+07  2.73e+02 1.64e-01  5.33e+02     7s
   3  -2.70119844e+06  4.25134646e+06  4.12e+01 7.19e-03  8.72e+01     8s
   4  -4.92188305e+05  9.11677446e+05  6.46e+00 2.54e-04  1.45e+01     8s
   5  -1.22036807e+05  2.15546791e+05  1.28e+00 6.54e-13  3.02e+00     9s
   6  -4.66437938e+03  4.16881557e+04  6.58e-02 3.55e-13  3.48e-01     9s
   7   6.34025101e+03  1.67540072e+04  1.44e-02 1.17e-13  7.72e-02    10s
   8   1.04604070e+04  1.23661801e+04  1.95e-03 1.26e-13  1.39e-02    10s
   9   1.12051834e+04  1.17925817e+04  5.62e-04 1.37e-13  4.30e-03    11s
  10   1.15253321e+04  1.16724988e+04  1.07e-04 1.57e-13  1.07e-03    12s
  11   1.15999164e+04  1.16396869e+04  1.59e-05 1.27e-13  2.84e-04    12s
  12   1.16077925e+04  1.16296301e+04  9.58e-06 1.40e-13  1.57e-04    13s

Barrier performed 12 iterations in 13.01 seconds (7.92 work units)
Barrier solve interrupted - model solved by another algorithm


Solved with dual simplex
Extra simplex iterations after uncrush: 13
Iteration    Objective       Primal Inf.    Dual Inf.      Time
   77112    1.1620696e+04   0.000000e+00   0.000000e+00     13s

Use crossover to convert LP symmetric solution to basic solution...
Crossover log...

    3355 DPushes remaining with DInf 0.0000000e+00                13s
       0 DPushes remaining with DInf 0.0000000e+00                14s

    1763 PPushes remaining with PInf 0.0000000e+00                14s
       0 PPushes remaining with PInf 0.0000000e+00                14s

  Push phase complete: Pinf 0.0000000e+00, Dinf 6.2794214e-13     14s

Iteration    Objective       Primal Inf.    Dual Inf.      Time
   88260    1.1620696e+04   0.000000e+00   4.072296e+04     15s
   98885    1.1621071e+04   0.000000e+00   6.419329e+03     20s
  104451    1.1621127e+04   0.000000e+00   4.730722e+03     25s
  109040    1.1621146e+04   0.000000e+00   1.126851e+04     31s
  112018    1.1621151e+04   0.000000e+00   8.181612e+02     35s
  115819    1.1621154e+04   0.000000e+00   1.743040e+02     40s
  118502    1.1621154e+04   0.000000e+00   5.683062e+00     45s
  119856    1.1621154e+04   0.000000e+00   1.742188e-03     51s
Extra simplex iterations after uncrush: 37840
  119896    1.1620696e+04   0.000000e+00   0.000000e+00     54s

Solved in 119896 iterations and 54.22 seconds (33.67 work units)
Optimal objective  1.162069615e+04
