
Gurobi 11.0.3 (mac64[x86]) logging started Mon Nov 18 13:07:27 2024

Set parameter LogFile to value "Results/result3.log"
Set parameter TimeLimit to value 36000
Gurobi Optimizer version 11.0.3 build v11.0.3rc0 (mac64[x86] - Darwin 23.4.0 23E214)

CPU model: Intel(R) Core(TM) i7-1060NG7 CPU @ 1.20GHz
Thread count: 4 physical cores, 8 logical processors, using up to 8 threads

Optimize a model with 288048 rows, 808640 columns and 1440176 nonzeros
Model fingerprint: 0x3aae90f6
Coefficient statistics:
  Matrix range     [1e+00, 1e+00]
  Objective range  [3e-03, 2e+00]
  Bounds range     [0e+00, 0e+00]
  RHS range        [1e-01, 1e+02]
Presolve removed 282869 rows and 800102 columns
Presolve time: 1.21s
Presolved: 5179 rows, 8538 columns, 29091 nonzeros

Iteration    Objective       Primal Inf.    Dual Inf.      Time
       0      handle free variables                          1s
Extra simplex iterations after uncrush: 1
       6   -0.0000000e+00   0.000000e+00   0.000000e+00      1s

Use crossover to convert LP symmetric solution to basic solution...
Crossover log...

       0 DPushes remaining with DInf 0.0000000e+00                 1s

     488 PPushes remaining with PInf 0.0000000e+00                 1s
       0 PPushes remaining with PInf 0.0000000e+00                 1s

  Push phase complete: Pinf 0.0000000e+00, Dinf 3.2404635e-15      1s

Iteration    Objective       Primal Inf.    Dual Inf.      Time
    1793   -0.0000000e+00   0.000000e+00   9.946731e-14      1s
Extra simplex iterations after uncrush: 12239
   14032   -0.0000000e+00   0.000000e+00   0.000000e+00      2s

Solved in 14032 iterations and 1.97 seconds (1.41 work units)
Optimal objective -0.000000000e+00

Gurobi 11.0.3 (mac64[x86]) logging started Mon Nov 18 13:08:13 2024

Set parameter LogFile to value "Results/result3.log"
Set parameter TimeLimit to value 36000
Gurobi Optimizer version 11.0.3 build v11.0.3rc0 (mac64[x86] - Darwin 23.4.0 23E214)

CPU model: Intel(R) Core(TM) i7-1060NG7 CPU @ 1.20GHz
Thread count: 4 physical cores, 8 logical processors, using up to 8 threads

Optimize a model with 288048 rows, 808640 columns and 1440176 nonzeros
Model fingerprint: 0xfe53f46d
Coefficient statistics:
  Matrix range     [1e+00, 1e+00]
  Objective range  [3e-03, 2e+00]
  Bounds range     [0e+00, 0e+00]
  RHS range        [1e-01, 1e+02]
Presolve removed 282885 rows and 800109 columns
Presolve time: 1.17s
Presolved: 5163 rows, 8531 columns, 29454 nonzeros

Iteration    Objective       Primal Inf.    Dual Inf.      Time
       0   -0.0000000e+00   0.000000e+00   5.468750e-03      1s
Extra simplex iterations after uncrush: 3
       3   -0.0000000e+00   0.000000e+00   0.000000e+00      1s

Use crossover to convert LP symmetric solution to basic solution...
Crossover log...

       0 DPushes remaining with DInf 0.0000000e+00                 1s

     485 PPushes remaining with PInf 0.0000000e+00                 1s
       0 PPushes remaining with PInf 0.0000000e+00                 1s

  Push phase complete: Pinf 0.0000000e+00, Dinf 3.1467884e-15      1s

Iteration    Objective       Primal Inf.    Dual Inf.      Time
    1802   -0.0000000e+00   0.000000e+00   1.002219e-13      1s
Extra simplex iterations after uncrush: 11978
   13780   -0.0000000e+00   0.000000e+00   0.000000e+00      2s

Solved in 13780 iterations and 1.95 seconds (1.36 work units)
Optimal objective -0.000000000e+00

Gurobi 11.0.3 (mac64[x86]) logging started Mon Nov 18 13:10:59 2024

Set parameter LogFile to value "Results/result3.log"
Set parameter TimeLimit to value 36000
Gurobi Optimizer version 11.0.3 build v11.0.3rc0 (mac64[x86] - Darwin 23.4.0 23E214)

CPU model: Intel(R) Core(TM) i7-1060NG7 CPU @ 1.20GHz
Thread count: 4 physical cores, 8 logical processors, using up to 8 threads

Optimize a model with 257520 rows, 808640 columns and 1409648 nonzeros
Model fingerprint: 0x2c9fcefa
Coefficient statistics:
  Matrix range     [1e+00, 1e+00]
  Objective range  [3e-03, 2e+00]
  Bounds range     [0e+00, 0e+00]
  RHS range        [1e-01, 1e+02]
Presolve removed 250478 rows and 797104 columns
Presolve time: 1.32s
Presolved: 7042 rows, 11536 columns, 34606 nonzeros

Concurrent LP optimizer: dual simplex and barrier
Showing barrier log only...

Ordering time: 0.00s

Barrier statistics:
 Free vars  : 58
 AA' NZ     : 3.318e+03
 Factor NZ  : 1.473e+04 (roughly 2 MB of memory)
 Factor Ops : 2.067e+05 (less than 1 second per iteration)
 Threads    : 1

Barrier performed 0 iterations in 1.36 seconds (0.79 work units)
Barrier solve interrupted - model solved by another algorithm


Solved with dual simplex
Extra simplex iterations after uncrush: 4
Iteration    Objective       Primal Inf.    Dual Inf.      Time
    1224    4.6108182e+03   0.000000e+00   0.000000e+00      1s

Use crossover to convert LP symmetric solution to basic solution...
Crossover log...

       0 DPushes remaining with DInf 0.0000000e+00                 1s

     560 PPushes remaining with PInf 0.0000000e+00                 1s
       0 PPushes remaining with PInf 0.0000000e+00                 1s

  Push phase complete: Pinf 0.0000000e+00, Dinf 3.3988437e-14      1s

Iteration    Objective       Primal Inf.    Dual Inf.      Time
    2936    4.6108182e+03   0.000000e+00   3.803468e-14      1s
Extra simplex iterations after uncrush: 29759
   32695    4.6108182e+03   0.000000e+00   0.000000e+00      4s

Solved in 32695 iterations and 4.25 seconds (3.45 work units)
Optimal objective  4.610818177e+03

Gurobi 11.0.3 (mac64[x86]) logging started Mon Nov 18 14:18:09 2024

Set parameter LogFile to value "Results/result3.log"
Set parameter TimeLimit to value 36000
Gurobi Optimizer version 11.0.3 build v11.0.3rc0 (mac64[x86] - Darwin 23.4.0 23E214)

CPU model: Intel(R) Core(TM) i7-1060NG7 CPU @ 1.20GHz
Thread count: 4 physical cores, 8 logical processors, using up to 8 threads

Optimize a model with 257520 rows, 808640 columns and 1409648 nonzeros
Model fingerprint: 0x2c9fcefa
Coefficient statistics:
  Matrix range     [1e+00, 1e+00]
  Objective range  [3e-03, 2e+00]
  Bounds range     [0e+00, 0e+00]
  RHS range        [1e-01, 1e+02]
Presolve removed 250478 rows and 797104 columns
Presolve time: 1.22s
Presolved: 7042 rows, 11536 columns, 34606 nonzeros

Concurrent LP optimizer: dual simplex and barrier
Showing barrier log only...

Ordering time: 0.00s

Barrier statistics:
 Free vars  : 58
 AA' NZ     : 3.318e+03
 Factor NZ  : 1.473e+04 (roughly 2 MB of memory)
 Factor Ops : 2.067e+05 (less than 1 second per iteration)
 Threads    : 1

Barrier performed 0 iterations in 1.28 seconds (0.79 work units)
Barrier solve interrupted - model solved by another algorithm


Solved with dual simplex
Extra simplex iterations after uncrush: 4
Iteration    Objective       Primal Inf.    Dual Inf.      Time
    1224    4.6108182e+03   0.000000e+00   0.000000e+00      1s

Use crossover to convert LP symmetric solution to basic solution...
Crossover log...

       0 DPushes remaining with DInf 0.0000000e+00                 1s

     560 PPushes remaining with PInf 0.0000000e+00                 1s
       0 PPushes remaining with PInf 0.0000000e+00                 1s

  Push phase complete: Pinf 0.0000000e+00, Dinf 3.3988437e-14      1s

Iteration    Objective       Primal Inf.    Dual Inf.      Time
    2936    4.6108182e+03   0.000000e+00   3.803468e-14      1s
Extra simplex iterations after uncrush: 29759
   32695    4.6108182e+03   0.000000e+00   0.000000e+00      4s

Solved in 32695 iterations and 4.09 seconds (3.45 work units)
Optimal objective  4.610818177e+03

Gurobi 11.0.3 (mac64[x86]) logging started Mon Nov 18 16:00:30 2024

Set parameter LogFile to value "Results/result3.log"
Set parameter TimeLimit to value 36000
Gurobi Optimizer version 11.0.3 build v11.0.3rc0 (mac64[x86] - Darwin 23.4.0 23E214)

CPU model: Intel(R) Core(TM) i7-1060NG7 CPU @ 1.20GHz
Thread count: 4 physical cores, 8 logical processors, using up to 8 threads

Optimize a model with 257648 rows, 810688 columns and 1412720 nonzeros
Model fingerprint: 0x7a8172ac
Coefficient statistics:
  Matrix range     [1e+00, 1e+00]
  Objective range  [3e-03, 2e+00]
  Bounds range     [0e+00, 0e+00]
  RHS range        [1e-01, 3e+02]
Presolve removed 251235 rows and 800108 columns
Presolve time: 1.29s
Presolved: 6413 rows, 10580 columns, 32489 nonzeros

Concurrent LP optimizer: dual simplex and barrier
Showing barrier log only...

Ordering time: 0.00s

Barrier statistics:
 Free vars  : 26
 AA' NZ     : 2.027e+03
 Factor NZ  : 7.497e+03 (roughly 1 MB of memory)
 Factor Ops : 1.014e+05 (less than 1 second per iteration)
 Threads    : 1

                  Objective                Residual
Iter       Primal          Dual         Primal    Dual     Compl     Time
   0   3.46783245e+03  6.66102352e+03  3.25e+01 4.10e-01  3.00e+01     1s

Barrier performed 0 iterations in 1.33 seconds (0.79 work units)
Barrier solve interrupted - model solved by another algorithm


Solved with dual simplex
Extra simplex iterations after uncrush: 2
Iteration    Objective       Primal Inf.    Dual Inf.      Time
     650    4.0273493e+02   0.000000e+00   0.000000e+00      1s

Use crossover to convert LP symmetric solution to basic solution...
Crossover log...

       0 DPushes remaining with DInf 0.0000000e+00                 1s

     514 PPushes remaining with PInf 0.0000000e+00                 1s
       0 PPushes remaining with PInf 0.0000000e+00                 1s

  Push phase complete: Pinf 0.0000000e+00, Dinf 2.2176705e-14      1s

Iteration    Objective       Primal Inf.    Dual Inf.      Time
    2354    4.0273493e+02   0.000000e+00   4.729116e-14      1s
   35298    4.0281384e+02   0.000000e+00   2.333242e+01      6s
Extra simplex iterations after uncrush: 33481
   35835    4.0273493e+02   0.000000e+00   0.000000e+00      6s

Solved in 35835 iterations and 6.15 seconds (4.84 work units)
Optimal objective  4.027349334e+02
